<?xml version="1.0" encoding="UTF-8"?>
<parameters xmlns:xsi="http://www.w3.org/2001/XMLSchema-instance"
 xsi:noNamespaceSchemaLocation="../../../xtpxlib-common/xsd/parameters.xsd">
  <!-- ================================================================== -->
  <!--~
    TBD
  -->
  <!-- ================================================================== -->
  
  <parameter name="owner-company-name">
    <value>Xatapult&#160;Content&#160;Engineering</value>
  </parameter>
  
  <parameter name="owner-company-website">
    <value>http://www.xatapult.com</value>
  </parameter>
  
   <parameter name="owner-company-phone">
    <value>+31&#160;6&#160;53260792</value>
  </parameter>
  
  <parameter name="owner-company-github">
    <value>https://github.com/xatapult</value>
  </parameter>
  
  <parameter name="author-name">
    <value>Erik&#160;Siegel</value>
  </parameter>
  
  <parameter name="author-email-address">
    <value>erik@xatapult.com</value>
  </parameter>
  
  <parameter name="library-name">
    <value>xtpxlib</value>
  </parameter>
  
  <parameter name="core-component-name">
    <value>xtpxlib-common</value>
  </parameter>

</parameters>
